mm5_calib_benchmark/outputs/mm5_benchmark/scene_282_3_comparison/cmp282_s282_scene_282_3_th_method_ranking.csv

rank,method,overall_region_error_px,normalized_overall_region_error,mean_iou,pixel_accuracy,boundary_f1,keypoint_transfer_error_px,valid_warp_coverage,num_test_scenes
1,M7,1.4635199113465205,0.0017856516418270731,0.45053111026912274,0.6358609626578616,0.2608861875486795,10.628324921925863,0.04781412760416666,30
2,M5,4.02909321380721,0.0049159269078134825,0.47372154447871195,0.9682377631056448,0.3244411668847823,13.547623952229818,0.9278509521484374,30
3,M4,4.4861367406051915,0.005473569149429708,0.4348005359403175,0.9638674365839758,0.24070976467296254,16.479189014434816,0.9460144042968751,30
4,M6,4.849973219441988,0.005917488771400383,0.4290911566389709,0.9612501562871923,0.23388214130228552,17.114113521575927,0.9218183390299478,30
5,M2,11.709140039980412,0.014286409754095657,0.2657117356412486,0.96428574877374,0.22765631692537702,16.700309213002523,0.9480799357096354,30
6,M1,12.5910731519262,0.015362462971491742,0.2548984481195362,0.9612960523227884,0.21896182464133895,17.543714459737142,0.9406129964192708,30

mm5_calib_benchmark/outputs/mm5_benchmark/scene_282_3_comparison/docs/cmp282_s282_met_note.md

## 当前排序结果（按 normalized_overall_region_error 从低到高，也就是从最好到最差）

- 1. M7: normalized_overall_region_error=0.18%diag, overall_region_error_px=1.46px, mean_iou=0.4505, boundary_f1=0.2609, pixel_accuracy=0.6359, valid_warp_coverage=0.0478, keypoint_transfer_error_px=10.63px
- 2. M5: normalized_overall_region_error=0.49%diag, overall_region_error_px=4.03px, mean_iou=0.4737, boundary_f1=0.3244, pixel_accuracy=0.9682, valid_warp_coverage=0.9279, keypoint_transfer_error_px=13.55px
- 3. M4: normalized_overall_region_error=0.55%diag, overall_region_error_px=4.49px, mean_iou=0.4348, boundary_f1=0.2407, pixel_accuracy=0.9639, valid_warp_coverage=0.9460, keypoint_transfer_error_px=16.48px
- 4. M6: normalized_overall_region_error=0.59%diag, overall_region_error_px=4.85px, mean_iou=0.4291, boundary_f1=0.2339, pixel_accuracy=0.9613, valid_warp_coverage=0.9218, keypoint_transfer_error_px=17.11px
- 5. M2: normalized_overall_region_error=1.43%diag, overall_region_error_px=11.71px, mean_iou=0.2657, boundary_f1=0.2277, pixel_accuracy=0.9643, valid_warp_coverage=0.9481, keypoint_transfer_error_px=16.70px
- 6. M1: normalized_overall_region_error=1.54%diag, overall_region_error_px=12.59px, mean_iou=0.2549, boundary_f1=0.2190, pixel_accuracy=0.9613, valid_warp_coverage=0.9406, keypoint_transfer_error_px=17.54px